<?xml version="1.0" encoding="UTF-8" ?>
<!DOCTYPE showroom SYSTEM "validation.dtd">

<showroom>
    <car>
        <brand>Mercedes-Benz</brand>
        <model>CLS</model>
        <year>2018</year>
        <price currency="лева">110444</price>
        <picture>https://www.masinipestoc.ro/images/cache/product_slider_large_thumb/uploads/images/car/mercedes-benz-cla-e6c708.png</picture>
        <color>Черен</color>
        <type>Купе</type>
        <seats>4</seats>
        <doors>4</doors>
        <weight>1860</weight>
        <dimensions>
            <length>4988</length>
            <width>1890</width>
            <height>1435</height>
        </dimensions>
        <engine>
            <size unit="см3">2.9</size>
            <power unit="hp">286</power>
            <cylinders>6</cylinders>
        </engine>
        <euroClass>6</euroClass>
        <transmission type="автоматик">
            <gears>9</gears>
        </transmission>
        <fuel>
            <fuelConsumption unit="L/100km">7</fuelConsumption>
            <fuelType>Дизел</fuelType>
            <tankCapacity unit="литра">50</tankCapacity>
        </fuel>
        <features>
            <AC>да</AC>
            <ABS>да</ABS>
            <rearCamera>да</rearCamera>
        </features>
        <trunkCapacity>520</trunkCapacity>
    </car>
</showroom>